modify,to make basic or fundamental change,had to ... his plans,/ˈmɒd.ɪ.faɪ/
teach,to instruct,He taught his children English,/titʃ/
study,to learn about a subject,to ... math,/ˈstʌd.i/
create,to bring into existence,The Bible says that God ...d the world,/kriˈeɪt/
throw,to send something through the air with force,The coat was ...n over the back of the chair,/θrəʊ/
act,to behave in the stated way,an ... of courage,/ækt/
die,to stop being alive,Twelve people ...d in the accident,/daɪ/
pay,to give money in return for goods or service,I paid the driver in cash,/peɪ/
plot,the story of a book/film/play/etc,The ... of that TV-show was exciting,/plɒt/
